title,date,content
"모바일·가전 부진에 메모리값도 뚝뚝…""올 영업익 60조 쉽잖아""",2022-07-07, 삼성전자  매출 신기록  제동   하반기 성적표 먹구름 우크라사태 인플레 경기부진 등복합 악재에 수익성 갈수록 악화3분기 D램 가격 10% 하락 예상 영업익 70%  차지 반도체 암울스마트폰은  아이폰14  출격 부담증권가 영업익 전망도 50조로↓ 서울경제 삼성전자 005930 가 2분기 어려운 대내외 여건 속에서 비교적 선방한 성적표를 냈지만 문제는 그다음이다  견조한 반도체 DS  부문 실적이 모바일 가전의 상대적으로 부진한 실적을 가렸지만 하반기부터는 메모리반도체의 가격 하락 등 시장 악화가 점쳐지는 상황이다  수익성 악화로 상반기 누적 영업이익이 28조 원대에 그치면서 연초 예상됐던  영업이익 60조 원  달성에도 빨간불이 들어왔다 ◇올해 영업이익 60조  빨간불  7일 에프앤가이드의 증권사 전망치 평균 컨센서스 에 따르면 삼성전자는 올해 매출 320조 4434억 원  영업이익 58조 9880억 원을 기록할 것으로 예상된다  하반기 우울한 경영 환경 속에서도 사상 첫 매출 300조 원 돌파가 유력할 것으로 전망된다  3분기 연속 이어져 온  매출 신기록  경신 행진이 깨졌지만 2분기에도 역대 2분기 중 최대 매출을 기록했을 정도로 여전히 탄탄한 경쟁력을 유지하고 있다  영업이익도 전 분기 14조 1200억 원  대비 소폭 0 85%  줄기는 했지만 2분기 역대 세 번째 수준으로 나쁘지 않다 문제는 각종 악재로 인한 수익성 저하가 하반기에 더욱 뚜렷하게 나타날 것이라는 전망에 있다  연초 업계에서는 탄탄한 반도체 수요를 바탕으로 삼성전자가 올해 국내 기업 중 역대 처음으로 매출 300조 원  영업이익 60조 원 동시 달성을 이룰 것으로 예상했다  하지만 최근 대내외 여건 악화로 증권사들이 영업이익 전망치를 잇따라 내리면서 한 달 새 전망치가 50조 원대로 내려앉았다 우크라이나 전쟁이 장기화되고 있고 코로나19 확산에 따른 중국의 주요 도시 봉쇄  글로벌 인플레이션 물가 상승  확산  금리 상승  경기 둔화 등으로 인한 수요 위축 등이 복합적으로 작용한 결과다  양호한 성적을 보인 1 2분기 누적 영업이익도 28조 1200억 원으로 30조 원에 미치지 못한 상황에서 극적인 대외 환경 변화 없이 60조 원 달성은 쉽지 않을 것이라는 전망이다 이번 잠정 실적 발표에서 삼성전자는 사업 부문별 실적 추정치를 공개하지 않았지만 업계에서는 영업이익 14조 원 중 반도체가 전체의 70%를 넘는 10조 원 이상을 차지했을 것으로 예상하고 있다  증권가에서는 반도체를 담당하는 DS 부문이 10조 7000억 원의 영업이익을 올렸을 것으로 예측했다  모바일 MX 은 2조 8000억 원  영상디스플레이 VD 는 4000억 원 수준으로 전 분기보다 큰 폭으로 줄어들었을 것으로 전망됐다  반도체가 선방한 가운데 모바일 가전의 부진이 3분기 연속 이어져 온 성장세의 발목을 잡았다는 해석이다 ◇스마트폰 부진 반도체 가격 하락 우려 삼성전자의 하반기 실적 부진이 염려되는 가장 큰 이유는 스마트폰의 실적 개선 전망이 밝지 않은 상황에서 반도체마저 시장 환경이 악화될 것으로 예상된다는 데 있다  가전제품도 경기 둔화로 가구의 실질 수요가 줄면서 수요가 대폭 줄어들고 있다 지금껏 반도체와 함께 삼성전자의 핵심 먹거리였던 스마트폰의 경우 판매량이 줄고 재고가 쌓이면서 위기에 놓였다  시장조사 업체 카운터포인트리서치에 따르면 5월 세계 스마트폰 판매량은 전년 동기보다 10% 감소한 9600만 대로 최근 10년간 두 번째로 1억 대를 밑돌았다  삼성전자 2분기 스마트폰 출하량은 약 6100만 대로 1분기 7300만 대보다 1200만 대가량 줄어든 것으로 추정된다 스마트폰 시장 전망은 하반기에도 어둡다  올해 스마트폰 총 판매량이 지난해보다 3% 줄어든 13억 5700만 대에 그칠 것으로 예상되고 있다  삼성전자는 보급형 제품에서 재고 처리  고급형에서 애플의 아이폰14와 격전을 벌여야 하는 부담을 안고 있다 그나마 선방한 반도체는 하반기 시장 전망이 염려스럽다  DS 부문의 핵심 분야인 메모리반도체가 시장 예상과 달리 견조한 수요를 유지하면서 실적을 지탱했지만 하반기부터는 결국 경기 둔화 영향권에 접어들 것이라는 예상이 나온다 대만 시장조사 업체 트렌드포스에 따르면 3분기 D램 가격은 2분기보다 10%가량 하락할 것으로 예상된다  메모리반도체의 또 다른 주력 제품인 낸드플래시도 최근 가격이 떨어지는 추세다  메모리카드 USB향 낸드플래시 범용제품 128Gb 16Gx8 MLC 의 6월 고정 거래 가격은 4 67달러로 5월 4 81달러 보다 3 01% 내렸다 가전 또한 각 시장조사 업체들이 올해 글로벌 TV 출하량을 연이어 하향 조정하는 등 수요 위축을 전망하고 있다 삼성전자는 글로벌 환경은 대처가 어려운 만큼 기술력을 바탕으로 한 사업 경쟁력 강화로 대응할 방침이다  업계 관계자는  신규 폴더블 스마트폰으로 프리미엄 시장 수요 촉발의 기대가 남아 있고 반도체는 시장 악화 우려에도 여전히 수요가 견고하게 받치고 있는 상황 이라고 말했다 
"대표는 불법투자 의혹, 직원은 횡령…메리츠운용 신뢰도 '흔들'",2022-07-07, 앵커  최근 회삿돈을 몰래 빼돌리는 간 큰 직원들 소식 자주 전해드리는데요  이번엔 메리츠자산운용 직원이 회사 자금을 7억 원 넘게 무단 인출한 사실이 적발됐습니다  신임 이복현 금융감독원장이 내부통제를 강화해 금융사고를 예방해 달라고 목소리를 높이고 있는 가운데 최근 존 리 전 대표의 차명투자 의혹에다 이번 횡령 사고까지  메리츠운용 회사 신뢰도에도 큰 타격을 입을 것으로 보입니다  김기송 기자의 보도입니다   기자  메리츠자산운용 직원 A 씨는 지난 3월 18일부터 6월 14일까지 3개월 간 여섯 차례에 걸쳐 7억 2 000만 원을 빼돌렸습니다  오전에 회사계좌에 있던 고객 돈을 자신의 계좌로 출금하고  오후에 다시 회사계좌로 넣는 방식으로 범행을 저질렀습니다  메리츠자산운용 측은 회사 자체 점검에서 이를 발견하고 즉시 금융감독원에 알렸으며  해당 직원은 징계 면직됐고 검찰에 고발했다고 밝혔습니다  또 이번 횡령으로 생긴 피해는 없으며  직원 A 씨가 횡령한 돈을 어디에 사용했는지 역시 아직 밝혀지지 않았다고 설명했습니다  문제는 직원이 수개월 동안 수차례에 걸쳐 자신의 통장처럼 회삿돈을 마음대로 빼고 넣고 했음에도 회사 측의 내부통제 시스템이 작동하지 않았다는 점입니다  자체 앱을 통해 직접 펀드를 판매하는 운용사들이 늘면서 내부통제 시스템을 강화해야 한다는 목소리가 커지는 이유입니다   이효섭   자본시장연구원 연구위원   내부 통제 소홀의 범위를 조금 더 구체화하고 무엇보다 역할과 책임을 명확하게 해서 처벌을 엄중히 할 필요가 있을 것 같습니다   금감원은 메리츠자산운용의 자체 조사가 끝난 뒤 최종 조사 결과를 보고받을 예정입니다  최근 발생한 존 리 전 대표의 불법투자 의혹에 이어 내부 직원 횡령 사고까지 연달아 터지면서 메리츠자산운용 신뢰도에 타격이 불가피하게 됐습니다  SBS Biz 김기송입니다 
'청년지원' 치고 나간 신한…금융권 '공적 역할' 확산 신호탄 될듯,2022-07-07,■ 5년간 청년층에 14조 지원코로나 장기화에도 역대급 실적금융사 사회적 책임 확대 공감대신한  주거 생활안정에 11조 투입청년특화 금융상품에 2 7조 지원향후 5년간 청년 7000명 채용도국민銀  이달 가계대출 대책 발표조용병 신한금융그룹 회장이 7일 서울 중구 신한금융 본사에서 열린  제2회 신한문화포럼 에 참석해 신한 문화의 발전 방향에 대해 발표하고 있다  이날 행사에는 조 회장을 비롯한 그룹사 CEO와 임원 본부장 등이 참석했다  사진 제공 신한금융그룹 조용병 신한금융그룹 회장이 7일 서울 중구 신한금융 본사에서 열린  제2회 신한문화포럼 에 참석해 신한 문화의 발전 방향에 대해 발표하고 있다  사진 제공 신한금융그룹 서울경제  창업 40주년  장년이 된 신한이 청년층의 든든한 지원자가 되겠습니다   신한 청년 포텐 Four Ten  프로젝트 는 신한금융그룹의 기업 시민으로서 역할뿐만 아니라 청년과의 동반 성장 의지를 담고 있다  1회성이 아닌 5년간 14조 원에 달하는 금융 지원을 통한 청년층의 성장이 다시 신한에는 고객 증대와 성장이라는 결과물로 돌아오기 때문이다  여기다 은행의 공공성 확대라는 사회적 요구에 대한 금융권의 첫 화답이기도 하다  서민과 취약계층 대출 부담 완화에 나섰던 금융권은 금리 상승기 금융의  사회적 책임 을 강조하며 대폭적인 지원에 나설 것으로 보인다  은행권에서는 KB국민은행이 이르면 이달 중 취약계층의 가계대출 금리를 인하하는 내용 등이 담긴  가계대출 지원 종합 대책 을 발표할 예정이다 금융지주 가운데 먼저 사회적 책임 실천에 나선 신한금융은 청년층의 주거  자산 형성  일자리  복지 등 4대 핵심 영역에 초점을 맞췄다  주거 생활 안정 차원에서 생애 최초로 주택을 구입하는 2030 청년들에게 금리를 인하해 이자 부담을 낮춰주는 방식으로 7조 6000억 원 규모의 금융 지원이 이뤄질 예정이다  특히 전월세대출 이용 비중이 높은 청년층에도 금리를 낮춰주는 방식으로 총 2조 5500억 원이 공급된다  신한은행은 5년간 2조 5000억 원 한도로 청년전월세자금대출을 이용하는 차주에게 0 7%포인트의 금리 우대를 해주기로 했다  계열사인 제주은행은 청년전세자금대출 상품 이용시 0 2%포인트 금리를 우대해준다  취약 청년층의 금융 부담을 완화해주기 위해 △햇살론 유스 Youth  고객 납입 보증료 전액 지원  긴급생활자금비상금대출 3000억 원 지원 신한은행  △새희망홀씨상품 청년 대상 추가 금리 우대 신설 제주은행  △청년특화저금리상품 핀셋론 확대 신한카드  등을 할 예정이다  청년층의 자산 형성을 위한 시드머니 마련도 지원한다  목돈마련적금과 청년특화금융상품을 공급하는 방식으로 총 2조 7000억 원을 지원할 예정이다  이를 위해 신한은행은 총 한도 2조 원의  청년목돈마련적금 에 가입하는 청년층에는 1%포인트 금리를 우대해준다  제주은행과 신한저축은행도 각각 0 5%포인트 우대금리를 제공한다  청년특화금융상품의 경우 신한금융투자 등이 지원에 나선다  총 4000억 원 한도 내에서 청년층이 중개형 ISA나 펀드 가입 시 일정 요건을 충족하면 판매 수수료나 투자 지원금을 지원하는 방식으로 이뤄질 예정이다 아울러 청년층 고용 창출 차원에서 앞으로 5년간 총 7000명을 채용한다  그룹 차원에서 매년 800명씩 향후 5년간 4000명  장애인이나 다문화 자녀 등 사회적 취약계층 2000명 등이다  여기에 청년 인턴십을 신설해 1000명을 뽑을 예정이다  신한금융은 청년층 취업 창업을 지원하기 위해 1675억 원을 배정했다  이를 통해 신한금융은 향후 5년간 1만 명의 청년 고용 효과가 나타날 것으로 전망했다  이밖에도 신한금융은 청년층 출산 육아 지원에 325억 원  장애 청년 일자리 교육 지원에 175억 원 등 총 500억 원을 지원한다 금융권에서는 신한금융그룹의 이번 프로젝트가  금융사의 공공의 역할  필요성에 대한 공감대가 형성된 데다 금융 당국이 금융사의  공공적 기능 을 압박한 점이 맞물리며 나온 것으로 보고 있다  코로나19 장기화에도 불구하고 금융지주들은 매 분기 사상 최대 순이익을 거뒀다  이를 두고 금리 상승기를 이용해 금융사들이  이자 장사 에만 골몰했다는 비판이 제기돼왔다  금융지주의 순이익 대부분은 대출 영업에 따른 이자 이익 비중이 높은 상황에서 은행이 주식회사이기는 하지만 다른 기업보다 공공성이 더 요구된다는 지적이 나오는 것도 이 때문이다  이복현 금융감독원장도 지난달 23일 열린 금융연구기관장과의 간담회에서  우리 헌법과 은행법 등 관련 규정에 따라 은행의 공공적 기능은 분명히 존재한다 면서 은행의  고통 분담  필요성을 강조했다 금융권에서는 신한금융의 프로젝트가 금융지주는 물론 여타 금융사들에 공공적 기능의 가이드 라인이 될 것으로 보고 있다  당장 은행권에서는 국민은행이 이르면 이달 중  가계대출 지원 종합 대책  발표를 준비 중이다  국민은행은 지난 4월에 이어 취약계층 등을 대상으로 가계대출 금리를 추가 인하하고 각종 금융 부대비용 수수료를 면제해 주는 내용 등을 발표할 예정인 것으로 알려졌다  고금리 대출을 이용하는 개인 사업자 등 기업을 대상으로 금리를 낮춰준 사례도 있다  하나은행은 11일부터 고금리 대출을 이용 중인 개인 사업자와 새희망홀씨대출 상품을 이용하는 취약계층에 대해 금리 인하를 해주기로 했다  고금리 대출을 이용하는 개인사업자 고객의 대출 만기 시점에서 연 7%를 초과하는 금리에 대해서는 최대 1%포인트  새희망홀씨대출 신규 신청 고객에게도 최대 연 1%포인트 금리를 낮춰준다  취약 계층을 대상으로 자체적으로 여신 상품 금리를 인하한 곳도 있다  신한은행은 6월 말 기준으로 연 5% 넘게 이자를 내는 주택담보대출 고객의 금리를 1년 간 연 5%로 감면하기로 결정해 약 3300여 명이 이자 감면 혜택을 받게 될 예정이다  우리은행은 지난달 24일부터 고정금리 대출에 적용하던 1 3%포인트의 우대금리 적용 대상을 기존 7등급 이내에서 10등급까지 확대했다 
"尹 대통령 ""지난 5년간 재정 상황 크게 악화… 정부부터 허리띠 졸라매야""",2022-07-07,나라살림 허리띠 죄기  50%대 중반 채무관리尹정부 첫 국가재정전략회의2027년까지  작년 목표보다 더 엄격히尹  재정만능주의 환상 벗어나야  강조새 재정준칙 마련  지출구조조정 예고윤석열 대통령이 7일 오전 충북 청주시 충북대학교에서 새정부 5년간의 국가재정운용방향을 논의하는 2022 국가재정전략회의를 주재하고 있다  연합뉴스정부가 2027년까지 국내총생산 GDP  대비 국가채무비율을 50%대 중반으로 관리하기로 했다  지난해 발표한 국가재정운용계획 2025년까지 국가채무비율 58% 보다 더욱 엄격하게 나랏빚을 조절하겠다는 뜻이다  이를 위해 관리재정수지를 활용한 새로운 재정준칙을 마련하고  과감한 지출구조조정 정책을 편다는 방침이다  새 정부는 문재인정부 5년간 이어진 확장적 재정 운용에서 벗어나 당장 내년 예산안부터  긴축 재정 에 돌입한다 7일 정부는 윤석열 대통령 주재로  2022년 국가재정전략회의 를 열고 이같이 밝혔다  국가재정전략회의는 새 정부 5년간의 나라 살림을 논의하는 회의로  이날 내용을 바탕으로 오는 9월 초 2023년 예산안과  2022∼2026년 국가재정운용계획 을 확정 발표하게 된다 윤 대통령은 이날 모두발언에서  지난 5년간 재정 상황이 크게 악화되면서 2017년 600조원이었던 국가채무가 400조원이 증가해 올해 말이면 1000조원을 훌쩍 넘어설 것으로 전망된다 며  당면한 민생 현안과 재정 위기 극복을 위해 정부부터 솔선해서 허리띠를 졸라매야 한다 고 밝혔다 윤 대통령은 이어  예산만 투입하면 저절로 경제가 성장하고 민생이 나아질 것이라는 그런 재정만능주의의 환상에서 이제 벗어나야 한다 며  재정이 민간과 시장의 영역을 침범하고 성장을 제약하지 않았는지  이른바  구축효과 가 작동하지 않았는지도 면밀하게 살펴볼 때가 됐다 고 말했다 이날 회의에서 정부는  민간 주도의 한국경제 재도약 뒷받침 과  재정의 지속가능성 제고 를 재정 운용 방향의 목표로 잡았다  이를 위해 △국정과제 적극 뒷받침 △건전 재정 기조 확립 △강력한 재정 혁신 △재정비전 2050 수립 추진을 4대 정책 방향으로 삼는다 우선 정부는 건전 재정의 기조를 위해 2027년 GDP 대비 국가채무비율 목표를 50%대 중반으로 잡았다  이는 2021∼2025년 국가재정운용계획상의 목표 2025년 58% 보다 2년 이상 채무 증가 속도를 늦춘 것으로  지난 5년간 국가채무비율 증가폭 14 1%포인트 의 3분의 1 수준이다 올해 1차 추가경정예산 편성 당시 국가채무비율은 50 1%다 문재인정부의 확장적 재정 기조는 건전 재정으로 전환된다  이를 위해 정부는 연말 기준  5 1%로 예상되는 GDP 대비 관리재정수지 수준을  3 0% 이내로 감축하기로 했다  재정수지는 세입과 세출의 격차로 나라 살림 현황을 나타내는 가장 중요한 지표 중 하나다 문재인정부에서 추진했던 재정준칙은 단순하고 엄격해진다  재정수지 기준을 관리재정수지로 바꾸고  재정적자는  3% 이내에서 통제한다는 방침이다  법적 근거도 기존 시행령에서 법률로 격상시키고  매년 예산안을 국회에 제출할 때 재정준칙 준수 여부를 따지기로 했다 강력한 지출구조조정도 예고했다  재량지출뿐 아니라 의무지출  계약에 따른 경직성 지출까지 구조조정 대상에 포함시켰다  공무원 정원 보수도 엄격하게 관리하고  인구 감소 등 구조적 문제 해결을 위한  재정비전 2050 도 연내 수립한다 최상대 기재부 2차관은 사전 브리핑에서  지금까지 과다하게 운영돼 왔던 확장적 재정 운용을 건전 재정 기조로 전환하면서 긴축  재정  방향으로 가는 것이 불가피한 측면이 있다 라며  새 정부 경제정책은 정부 주도에서 민간 주도로  전환해  민간의 역량을 최대한 끌어내는 기조 라고 말했다 
소비자 지갑 닫히자 기업 투자 줄었다,2022-07-07, 앵커  국내 대표 기업이자 견고한 사업구조를 갖고 있는 두 기업마저 다소 주춤한 실적을 기록하면서 경기 침체 우려감이 커지고 있는데요  강산 기자와 이야기 나눠보겠습니다  이번 실적을 보는 시각은 다소 엇갈린 측면이 있죠   기자  일단은 선방했다고 보는 시각도 있는데  하반기 전망에 대해선 대부분 부정적이다 보니 선방이란 측면보다 실적 악화의 시작이다라고 보는 시각도 많습니다  삼성전자와 LG전자 모두 2분기 기준으로는 역대 최대 매출을 기록했지만  영업이익을 놓고 보면 주춤했습니다  스마트폰 등 IT 기기 수요 부진이 삼성 매출의 핵심인 반도체 수요 감축으로 이어지게 되면 상황은 훨씬 어려워집니다  하반기 메모리 반도체 가격이 좀처럼 반등할 기미를 보이지 못하면서 실적 추정치 역시 떨어지고 있습니다   앵커  TV와 가전 사업 부진은 어느 정도인가요   기자  시장조사업체 옴디아는 지난 3월 연간 TV 출하량이 2억 1 000만여 대로  12년 만에 최저치를 기록할 것으로 예상했는데요  최근 이 전망치를 지난해보다 284만 대 더 낮춰 잡았습니다  어제 6일  삼성전자 생활가전사업부의 경우 가장 낮은 수준인 기본급의 62 5%의 성과급 지급률이 통보된 바 있습니다  올 상반기 원자재 가격 상승과 물류비 인상  수요 위축 등의 영향으로 가전 수익성 하락은 물론 유통 재고가 많았을 것으로 파악됩니다   앵커  대기업 상황이 안 좋으면 중소기업도 영향을 받을 수밖에 없는데  전반적인 기업 투자도 위축되고 있죠   기자  한국거래소에 따르면 올 상반기 코스피  코스닥 상장사가 공시한 신규 시설투자는 6조 5 000억 원 수준으로 지난해보다 9% 줄었습니다  2분기만 놓고 보면 3조 6 000억 원으로 지난해보다 28% 줄었습니다  러시아 우크라이나 사태 장기화  또 기준금리 인상과 증시 부진으로 자금 조달이 어려워진 데다 대외 불확실성이 커진 영향으로 풀이됩니다   추광호   전국경제인연합회 경제본부장   기존에 검토했던 투자 계획을 불확실성이 어느 정도 해소될 때까지 잠정적으로 축소하거나 혹은 연기하는 예상이  나오고요   불확실성 기간이 어느 정도 갈지 방향성이 잡히면 그 이후에야  투자가 확대되겠죠    시장조사업체 가트너는 미 연준이 금리 인상을 예고한 상황에서 물가상승  여기에 공급망 혼란으로 올해 전자기기를 중심으로  퍼펙트 스톰 이 올 것으로 내다봤습니다   앵커  강산 기자  잘 들었습니다 
