title,date,content
"삼성D·삼성전기, 상반기 성과급 지급",2022-07-07,목표달성장려금 지급률 공지서울 서초구 삼성서초사옥으로 한 임직원이 들어가고 있다  ⓒ데일리안 류영주 기자 데일리안   이건엄 기자  삼성디스플레이와 삼성전기 등 삼성 전자계열사들이 잇달아 상반기 성과급 지급에 나서고 있는 것으로 파악됐다 7일 업계에 따르면 삼성디스플레이와 삼성전기는 전날 임직원들에게 각 사업부별 상반기 성과급인 목표달성장려금 TAI  지급률을 공지했다  TAI은 과거 생산성격려금 PI 에 해당하는 성과급으로 매년 상반기와 하반기에 한차례씩 지급된다 삼성디스플레이는 중소형과 대형사업부 직원들에게 모두 100%의 성과급을 지급한다  삼성전기는 적층세라믹캐패시터 MLCC 를 담당하는 컴포넌트사업부와 플립칩 볼그리드어레이 FC BGA  등 반도체 기판을 담당하는 패키지솔루션사업부에 성과급 100%를 책정했다  카메라모듈을 만드는 광학통신솔루션사업부 직원들은 기본급의 75%를 성과급으로 받게 된다 앞서 삼성전자도 같은날 각 사업부에 TAI 지급률을 안내했다  디바이스솔루션 DS  반도체 부문 시스템LSI 파운드리사업부는 월 기본급의 100%  발광다이오드 LED 사업부는 기본급의 75%가 책정된 것으로 전해졌다  디바이경험 DX 부문은 사업부에 따라 상이한 금액이 책정된 것으로 알려졌다 
강남구 집값도 꺾였다... 전국 아파트값 9주 연속 하락,2022-07-07,서울은 0 03% 떨어져수도권 지방 낙폭 줄어시 도별 아파트 매매가격지수 변동률  한국부동산원 제공 서울 집값 바로미터 로 꼽히는 강남구 아파트값이 17주 만에 떨어졌다  금리 인상 우려로 전국 아파트값 하락세가 이어지고 있다 7일 한국부동산원에 따르면 7월 첫째 주 7일 기준  전국 주간 아파트 매매가격은  0 03%로 9주 연속 하락했다  2019년 이후 전국 집값이 9주 내리 떨어진 건 처음이다 서울아파트값은  0 03%로 지난주 하락폭을 유지했다  서울 25개 자치구 중 상승한 곳은 서초구 0 02% 가 유일했다  강남구는 4주간 보합을 이루며 버티다가 이번주  0 01%로 하락 전환했다  송파구  0 02% 와 강동구  0 04% 는 매물이 쌓이며 지난주에 이어 하락했다  강북구는 미아동 단지 위주로 하락하며  0 08%로 서울에서 가장 크게 떨어졌다  부동산원 관계자는  추가 금리 인상  하반기 경기 침체 우려로 매수 심리가 위축되면서 서울 전체 하락세가 지속됐다 고 설명했다 수도권과 지방은 각각  0 04%   0 02%로 지난주보다 0 01%포인트 낙폭이 줄었다  인천은 가격 상승 피로감이 있는 송도신도시 위주로 떨어지며  0 07%를 찍었다  경기는 이천시 0 25%   평택시 0 05%  등은 상승했으나 수원시 영통구  0 02%   광주시  0 18%  등의 하락폭이 커지며 0 04% 떨어졌다 규제지역에서 해제된 △대구  0 19%→ 0 11%  △대전  0 08%→ 0 06% 은 지난주 대비 하락세가 소폭 줄어들었다  세종 아파트값은 0 14% 감소했다  광주는 0 01% 상승률을 보였다 전세가격도 내림세다  전국 주간 아파트 전세가격은  0 02%로 낙폭을 유지했다  수도권은 지난주  0 03%에서  0 04%로  서울은  0 01%에서  0 02%로 더 가파르게 떨어졌다  지방은 0 01% 내렸다 
원가 부담 타격…삼성·LG 2분기 가전 영업익 급감,2022-07-07,기사내용 요약물가인상 심화 금리인상으로 소비심리 위축경쟁 심화로 인한 마케팅 비용 증가 등 영향 서울 뉴시스  김금보 기자   삼성전자가 올해 2분기 매출액 77조원  영업이익 14조원을 달성했다고 7일 밝혔다  사진은 7일 서울 서초구 삼성전자 서초사옥  2022 07 07  kgb newsis com 서울 뉴시스 동효정 기자   삼성전자와 LG전자가 2분기 글로벌 악재 속에도 선방하는 실적을 기록했으나 원가 부담 상승 압박으로 인해 가전업계 영업이익은 타격을 입었다 원재료 구매 가격이 상승하고 해상 운임 등이 지속적으로 상승하면서 물류비 부담이 가중돼 수익성이 하락했다는 평가다 삼성전자  2분기 매출 77조대 돌파 역대 2번째7일 삼성전자는 2분기 잠정 실적 발표를 통해 매출 77조원  영업이익 14조원을 기록했다고 밝혔다  전년 동기 대비 각각 20 9%  11 4% 증가한 수치다 증권가에서는 반도체 부문은 견조한 실적을 이어갔으나 가전과 TV를 담당하는 소비자가전 CE  부문의 매출이 급감한 것으로 추산하고 있다 업계는 가전부문 2분기 매출이 14조원대  영업이익은 5000억원대를 기록할 것으로 전망했다  전년보다 매출은 소폭 올랐으나 영업이익은 절반 수준이다 LG전자  2분기 잠정 영업익 7917억 전년比 12%↓LG전자도 이날 연결기준으로 2분기 매출 19조4720억원  영업이익 7917억원을 달성했다고 발표했다  매출은 전년 동기 대비 15% 늘었고 영업이익은 12% 줄었다 LG전자는 전장사업 수익성이 개선됐으나 가전 부문 영업이익 악화가 실적에 부정적 영향을 미쳤다 글로벌 인플레이션 심화 및 가전 TV 수요가 감소하면서 영업이익이 감소했다는 분석이다 증권가는 LG전자의 생활가전을 담당하는 H&A사업본부 매출은 7조원 중후반대  영업이익은 4000억원 중반대로 보고있다  매출은 전년보다 약 1조원 늘어났지만  영업이익은 2000억 가량 줄어든 수치다  서울 뉴시스  최동준 기자   LG전자가 올해 2분기 매출액이 19조4720억 원  영업이익이 7917억 원으로 잠정 집계됐다고 7일 밝혔다  전년 동기 대비 매출은 15% 증가했고  영업이익은 12% 감소했다  사진은 이날 서울 여의도 LG트윈타워 모습  2022 07 07  photocdj newsis comLG전자는 이날 잠정실적과 관련해  가전 사업의 경우 주요 시장의 물가인상 심화  금리인상 추세 및 이에 따른 소비심리 위축 영향으로 가전 수요는 전반적으로 둔화됐다 고 평가했다 LG전자는  원재료 구매가격 상승  해상운임 등 물류비 상승의 부담 지속되면서 경쟁 심화 대응 및 적정 유통 재고 수준 관리를 위한 비용 증가 영향으로 수익성이 지난해 대비 감소했다 고 말했다 또 LG전자는  TV사업의 경우 포스트 코로나 19에 따른 일상 회복 본격화 및 TV 시청 시간 축소 등의 영향으로 매출이 전년 동기 대비 감소했다 면서  LCD 패널 가격 하락 등 원가 개선 요인에도 불구하고 경쟁심화에 따른 마케팅 비용 증가 등으로 전년 동기 대비 영업이익이 감소했다 고 밝혔다 하반기 전자업계 영업이익이 더욱 타격 예상업계는 장기화되는 우크라이나 러시아 전쟁과 글로벌 인플레이션으로 하반기 전자업계 영업이익이 더욱 타격을 입을 것으로 예상하고 있다 증권가는 당초 LG전자의 올해 연간 매출액은 11 4% 증가한 83조2258억원  영업익은 21 9% 증가한 4조7089억원 기록할 것으로 전망했으나 최근 하향 조정에 돌입했다 삼성전자의 연간 매출 전망치도 낮추고 있다 신한금융투자는 올해 삼성전자의 매출액 전망치를 318조560억원에서 313조7330억원으로 1 5% 하향 조정했다  올해 영업이익 전망치 역시 60조1330억원에서 58조4860억원으로 2 7% 낮췄다 
서울 강남 아파트값 4개월 만에 하락 전환,2022-07-07, 5시뉴스 서울 아파트값이 6주 연속 약세를 보이는 가운데 강남구 아파트값도 4개월 만에 하락했습니다 한국부동산원 조사에 따르면 이번 주 서울 아파트값은 지난주와 마찬가지로 0 03% 떨어지며 6주 연속 하락세를 보였으며  4주째 보합이던 강남구 아파트값이 0 01% 떨어졌습니다 강남구 아파트값이 하락한 것은 올해 3월 7일 조사 이후 4개월 만입니다 송파구는 지난주보다 0 02%  강동구는 0 04% 각각 하락했습니다 MBC 뉴스는 24시간 여러분의 제보를 기다립니다 ▷ 전화 02 784 4000▷ 이메일 mbcjebo mbc co kr▷ 카카오톡  mbc제보
"박두선 대우조선 사장 ""불법파업에 하루 320억 피해""",2022-07-07,기사내용 요약7일 옥포조선소에서 긴급 기자간담회 개최신속한 공권력 투입 호소  불법행위 철저히 수사해야  서울 뉴시스  대우조선해양 박두선 사장이 7일 거제 옥포조선소에서 열린 긴급 기자간담회에서 기자회견문을 읽고 있다   사진 대우조선해양 제공   재판매 및 DB 금지 서울 뉴시스  옥승욱 기자   박두선 대우조선해양 사장이 하청지회 불법파업으로 연일 피해가 불어나자 7일 긴급 기자간담회를 열고 신속한 공권력 투입을 촉구했다 박 사장은 이날 오후 경남 거제 옥포조선소에서 열린 기자간담회에서  하청지회 불법파업에 따른 진수 지연으로 하루에 매출 감소 260여억원  고정비 손실 60여억원이 발생하고 있다 며  조선소의 심장인 도크가 폐쇄되면서 사내 직영 및 협력사 2만명  사외 생산협력사 및 기자재 협력사에 소속된 8만명 등 총 10만여명의 생계 또한 심각한 위협을 받고 있다 고 밝혔다 대우조선해양은 지난해 1조7000억원의 대규모 손실을 봤고  올해 1분기도 강재가 추가 상승으로 인해 4700억원의 영업 적자를 기록했다  부정적 환경에도 지난해 연말부터 LNG선을 중심으로 선박 발주시장이 살아나며 올해 현재까지 26척 59억3000만 달러를 수주 달성률 66 4% 하면서 3년치의 안정적인 일감을 확보했다 박 사장은  생산물량 부족 문제를 해소함과 동시에 선가가 좋은 LNG선을 중심으로 수주한 만큼 향후 흑자 전환도 가능하다는 희망을 가졌다 며  생존을 넘어 경영정상화도 앞당길 수 있으리라 기대했다 고 말했다 대우조선해양은 현재 하청지회의 1도크 선박 점거로 진수가 미뤄지고 공정도 멈추는 등 피해를 입고 있다  하청지회는 임금 30% 인상을 고수하며 요구안이 받아들여지지 않으면 물러설 수 없다는 입장이다 박 사장은  이처럼 위중한 전환기에 거통고조선하청지회는 불법파업을 강행했다 며  그 과정에서 직원 폭행  에어 호스 절단  작업자 진입 방해  고소차 운행 방해  1도크 점거  물류 적치장 봉쇄 등의 무법적 행위를 자행했다 고 말했다 이어  진수 지연으로 매출과 고정비 손실만 6월 말까지 2800여억원이 넘는다 며  여기에 LD 인도 일정 미준수로 인한 지체보상금 까지 감안하면 공정 지연 영향 금액은 더 커질 것으로 보인다 고 부연했다 문제는 1도크 진수를 언제 할 수 있을지 기약이 없다는 점이다  대우조선해양은 조선소의 심장인 도크가 폐쇄됨에 따라 선후 공정인 선행  가공  조립  의장  도장 등 전 공정의 생산량을 조정할 수 밖에 없는 처지다 박 사장은  회사는 어제 공종별 부하에 따라 OT와 특근 조정  야간 작업 중단 등의 생산 일정 조정을 발표했다 며  사태가 장기화될 경우 주간 근무시간 축소도 불가피해 보인다  임원들은 24시간 비상 체제를 가동하며 현 위기 해소에 앞장서기로 했다 고 강조했다 이어  최근 수많은 난관이 있지만 선가가 좋은 LNG선을 중심으로 3년치 물량을 확보한 만큼 재도약을 위한 환경이 조성돼 있다 며  오랜만에 찾아온 조선 호황  이를 통한 일자리 창출  지역 및 국가 경제 활성화 기여 등의 기회가 일부 계층의 생산 중단 등 불법 파업으로 물거품이 되지 않도록 2만명 구성원의 절박한 심정을 담아 간곡히 부탁드린다 고 호소했다 아울러  지금 피해가 대우조선해양에만 국한되는 것이 아니라 향후 전체 조선업으로 확산돼 대한민국 조선산업의 존립을 위태롭게 할 수 있다 며  국가기간산업에서 벌어진 작업장 점거  직원 폭행  설비 파손  작업 방해 같은 모든 불법행위에 대해 철저히 수사하고 법 질서를 바로잡아 주길 바란다 고 덧붙였다．
"정부, 980조원 우크라이나 재건…'철도주' 숨은 수혜주 부각",2022-07-07, 파이낸셜뉴스  최근 정부가 정부 공기업 기업으로 구성된 협의체를 꾸리고 우크라이나 재건 사업에 참여한다고 밝히자 관련 수혜주에 관심이 쏠리고 있다  특히 기존 재건 프로젝트 중에서도 경제 발전과 복원  기간시설 복원에 가장 중요한 요소로 철도가 꼽히면서 철도 관련주가 숨은 수혜주로 부각되고 있다 7일 한국거래소에 따르면 대호에이엘은 최근 2거래일 동안 주가가 3 6% 상승했다  지난 5일 2 27%  6일 1 33% 강세를 보이고 있다  현대로템도 이날 1 6% 상승했다  특히 지난달 24일부터 29일까지 3거래일 동안 총 14%대 상승하면서 주목 받았다 이처럼 최근 철도 관련주들이 강세를 보이는 것은 러시아 우크라이나 사태의 재건 프로젝트의 핵심으로 철도가 새롭게 떠오르고 있기 때문이다 앞서 지난 6일 국토교통부는 원희룡 장관이 드미트로 포노마렌코 주한 우크라이나 대사  우크라이나 의원 두 명과 만나 마리우폴 등을 재건하는 사업에 대한 협력 방안을 논의했다고 밝혔다 국토부 관계자는  7500억달러 980조5500억원  규모 전후 우크라이나 재건 사업에 국내 기업들의 참여가 확대될 전망 이라고 말했다  이를 위해 국토부는 이달 중 우크라이나 재건협의체를 구성하고 우크라이나 정부와 협력 네트워크를 구축할 계획이다 업계에 따르면 지난달 러시아 미사일 부대는 철도가 군대를 전선으로 수송하는 건 물론 국가 경제 차원에서 철도의 전략적 중요성을 깨닫고 철도 시설을 공격한 것으로 알려졌다  러시아도 남서부 로스트프 주와 우크라이나 동남부 돈바스 지역을 연결하는 철도를 개통할 계획인 것으로 알려졌다 이처럼 철도 관련 사업이 예정되자 국내에서도 대표적인 수혜기업으로 현대로템  대호에이엘 등이 주목받고 있다 현대코퍼레이션과 현대로템은 2010년 우크라이나 철도청에 고속전동차 90량을 공급한 바 있다  현대로템은 2012년에는 차량의 유지보수 사업을 수주했으며 2015년에는 추가로 년 더 연장해 올해까지 유지보수를 맡는다  현대로템은 우크라이나 사태에도 현지 고속 열차를 수리하며 사업 능력을 인정받은 바 있다  현대로템은 현대코퍼레이션과 수출입은행  무역보험공사와 공동으로 우크라이나 고속철도 사업에도 참여하는 것으로 알려졌다  현대코퍼레이션이 사업 전반을 이끌고 현대로템이 건설을  수은과 무보가 자금을 대는 방식이다 대호에이엘은 현대로템의 1차 협력사로  현대로템이 수주를 하면 알루미늄 1차 가공을 통해 생산하는 객차 공급에 대한 수주가 이뤄질 가능성이 높다  대호에이엘은 지난달 우크라이나 전쟁 종식 및 평화기원을 위해 우크라이나 정부에 1억원의 평화기금을 전달한 바 있다 
서울 아파트값 6주째 떨어져…강남도 4개월만에 하락 전환,2022-07-07,서울 송파구 롯데월드타워 서울스카이에서 바라본 강남구 일대 아파트 단지 모습  뉴스1서울 아파트 가격이 6주째 떨어지는 가운데 서울 강남구 아파트 가격도 4개월 만에 하락으로 전환했다  금리 인상과 경기 침체 등으로 매수 심리 위축세가 이어지며 한동안 하락세가 이어질 것으로 보인다 7일 한국부동산원의 주간 아파트 가격 동향에 따르면 7월 첫째 주 4일 기준  서울 아파트값은 지난주보다 0 03% 내리며 6주 연속 하락세를 이어갔다  특히 4주째 보합 0% 을 유지하던 강남구 아파트 가격이 0 01% 떨어졌다  올해 3월 7일 ―0 01%  조사 이후 4개월 만의 하락 전환이다  부동산원은  강남구 청담동과 도곡동을 중심으로 매물이 쌓인 영향 이라고 했다  서초구 0 02% 는 서울 25개 자치구 중 유일하게 아파트값이 올랐다 서울 아파트 전세가격도 0 02% 내리며 지난주 ―0 01% 보다 가파른 하락세를 보였다  전국 아파트 매매가격은 전주 ―0 04%  대비 하락 폭이 줄면서 ―0 03%로 나타났다  수도권 ―0 05→―0 04% 과 지방 ―0 03→―0 02%  역시 하락 폭이 감소했다 전문가들은 하반기 7 12월 에도 현 상황이 계속될 가능성이 높다고 봤다  고준석 제이에듀투자자문 대표는  추가 금리 인상이 예상되는 데다 고물가에 따른 글로벌 경기 리스크도 커지고 있어 부동산 매수 심리 위축세가 이어질 것 이라고 말했다 
"文 '코드인사' 홍장표, ""정권 나팔수"" 거론할 자격 있나",2022-07-07,사퇴 압력에 강한 반발심 표출한 자신감 근거는 홍 취임과 함께 KDI는  정권의 나팔수  기관 전락홍장표 당시 소득주도성장특별위원회 위원장이 2018년 11월 14일 서울글로벌센터에서 열린  노동시장 격차 완화와 소득주도성장  토론회에서 인사말을 하고 있다  ⓒ데일리안 DB 데일리안   유준상 기자  홍장표 한국개발연구원 KDI  원장이 한덕수 국무총리로부터 사퇴 압박을 받은 것과 관련해  KDI와 국책연구기관이 정권의 입맛에 맞는 연구에만 몰두하고 정권의 나팔수가 되어야 한다고 생각한다면  국민의 동의를 구해 법을 바꾸는 것이 순리라고 생각한다 며 강한 불만을 표출했다 홍 원장의 발언이 성립되려면 최소한 사퇴 압력에 대항할  떳떳한 명분 이 있어야 한다  하지만 홍 원장의 행적을 돌이켜보면  KDI는 정권의 나팔수가 아니다 라는 강한 반발과 기개의 근원이 무엇인지 물음표를 던질 수밖에 없다 홍장표 원장은 문재인 정권  보은 인사  논란에 휩싸였던 인물이다  전 정부 임기가 1년도 채 남지 않았던 작년 5월 KDI 출신 원로 학자들의 홍 원장 선임 반대에도 정부가 임명을 강행하자  정권 말까지 코드 인사가 지속되고 있다는 비판이 나왔다  당시 야권을 비롯해 송영길 민주당 대표조차 문재인 정부 핵심 경제정책인  소득주도성장 을 비판하고 나섰다 홍 원장은 문재인정부 초대 경제수석을 거쳐 정책기획위원회 산하 소득주도성장특위 위원장을 지냈다  말하자면 홍 교수는 소득주도성장의 설계자다  소득주도성장이란 근로자의 소득을 인위적으로 높이면 소비가 증대되면서 경제성장을 유도한다는 논리를 담고 있다 역설적이게도 소득주도성장은 고용 상황과 분배 지표를 악화시켰다   2020년 최저임금 1만원 달성 이라는 대선 공약을 실현하겠다며 임기 초반 최저임금을 급격하게 올렸다가 자영업자들이 심각한 위기에 직면하기도 했다  소득주도성장은 가격이 높아지면 수요가 줄어들 수밖에 없고 그에 따라 실업이 증가할 수밖에 없는 경제학 기본 원리에 애당초 위배됐다 학계에서도 소득주도성장은 이미 실패로 결론이 났고 더 이상 지지자를 찾기 힘든 상황에 직면했다  심지어 노무현 정부에서 청와대 정책실장을 지낸 이정우 경북대 명예교수조차  일자리라는 마차는 경제성장이라는 말이 끄는 결과이기 때문에 마차를 말 앞에 둘 수 없다 고 직격을 날렸다 그럼에도 문재인정부는 분명한 정책 실패에 대한 제대로 된 해명이나 반성 입장을 표명하지 않았다  각종 경제 지표가 악화되자 2020년 이후부터 청와대에서 소득주도성장이라는 용어가 사라졌다  그 자리에 포용성장이란 용어가 들어갔다 이러한 맥락에서 문재인정권이 홍장표 당시 부경대 교수를 KDI 원장으로 내정한 것은 KDI를  정권의 나팔수  정도 되는 기관으로 전락시키는 분명한 시그널을 줬다  청와대 경제수석 출신이 조직을 이끌게 되면서 경제정책 싱크탱크인 KDI 연구보고서에 정치색이 묻지 않을 수가 없었다  어제 홍 원장이  KDI는 정권의 나팔수가 아니다 고 언급한 건 그 자체로 위선적이라는 평가다 홍 원장 취임 당시 KDI 내부 반발이 만만찮았던 점도 주목할 만하다  당시 KDI는 정통파 경제학자들이 주축이 됐던 반면 홍 원장은 비주류인 후기 케인스학파로 분류됐다  2018년엔 KDI 선임연구위원이  최저임금 인상 속도를 조절할 필요가 있다 는 보고서를 내면서 파문이 일기도 했다  KDI의 정치화를 과연 누가 선동했는지 홍 원장은 스스로 돌아보아야 할 필요가 있다는 지적이 나온다 
"“금리 우려는 지났다” 가벼워진 美 증시, 7월에도 최선호",2022-07-07,서학개미  6월 거래대금 올해 최저치최근 국내 수급  대부분 3배 추종 ETF에 몰려 헬스케어  필수소비재 등 최선호 업종 제시 이데일리 유준하 기자  지난달  서학개미  거래대금이 올해 최저치를 찍은 가운데 경기 침체 우려에 치솟던 원자재 가격이 서서히 빠지고 있다  이에 간밤 미국 3대 증시가 소폭 상승 마감한 데다 이날 국내 증시까지 상승하는 등 밸류에이션에 대한 부담이 줄었다는 분석이 나온다 자료 한국예탁결제원 세이브로7일 한국예탁결제원 증권정보포털에 따르면 지난달 월별 기준 미국 주식 매수금액과 매도금액의 합계치는 213억9872만달러로 전월 241억1758만달러 대비 10% 넘게 감소했다  지난 2020년 11월 187억4252만달러 이래 최저치로 약 1년8개월 만이며 2020년도 이래 월평균 대금인 235억8558만 달러마저도 밑돌았다 이는 최근 경기 침체 우려와 치솟는 물가에 따른 위험자산 기피 심리 등이 복합적으로 작용한 결과다  크리스탈리나 게오르기에바 국제통화기금 IMF  총재는 6일 현지시간   글로벌 경제 전망이 상당히 어두워졌다 면서 내년에 세계적인 경기 침체가 닥칠 가능성을 경고했다  특히나 올해보다 내년이 더 어려울 것이란 전망을 내놔 눈길을 끌었다 100달러를 웃돌던 국제유가 가격은 2거래일 연속 90달러대를 기록했다  경기 침체가 선반영되면서 원자재에 대한 수요 역시 줄어들리란 전망 때문으로 풀이된다  씨티그룹의 원유 수요 전망치는 종전보다 3분의 1 정도 줄어든 하루 240만∼250만 배럴 bpd 인데  이는 미국 에너지정보청 EIA 이나 국제에너지기구 IEA 의 예측치와 유사하다  씨티그룹은 연말까지 원유 공급이 늘어날 것으로 보면서  기본적으로 유가가 배럴당 85달러대가 될 것으로 보고 있다 이웅찬 하이투자증권 연구원은  높은 가격 부담에 경기 침체 우려가 커지며 원자재에 대한 수요 파괴 현상이 발생했기 때문 이라고 분석했다  그는  상반기 주가 하락은 금리 텐트럼에 따른 밸류에이션 하락이었지만 이제 금리 텐트럼은 없다 고 봤다 특히 미국의 경우 글로벌 국가 가운데서도 선방했다는 평가도 나온다  이신영 KB증권 연구원은  지난달 글로벌 증시는 경기침체 우려로 에너지  소재 등 경기민감 업종의 낙폭이 컸는데 미국의 경우 필수소비와 헬스케어 등 방어 업종들이 견조한 수익률을 나타냈고 그간 과매도에 따른 저가매수 심리로 일부 성장주가 반등  글로벌 국가 중 가장 선방  내달에도 최선호국으로 본다 고 평가했다 또한 경기가 증시에 미치는 영향이 높아진 만큼 방어업종에 집중할 것을 조언했다  이신영 연구원은  방어업종인 유틸리티와 헬스케어  필수소비재를 최선호 업종으로 제시한다 고 말했다 다만 서학개미들의 투자 행태는 증권가의 조언과는 반대였다  최근 한 달간 서학개미가 가장 많이 사들인 종목은 나스닥 3배 인버스 상장지수펀드 ETF 인  프로셰어즈 울트라프로 QQQ 로 1억8165만달러를 기록해 눈길을 끌었다  이어 필라델피아 반도체지수 수익률의 3배를 추종하는  디렉시온 데일리 세미컨덕터 불 3X SHS ETF 이 1억5232만달러로 2위  테슬라는 8408만달러를 기록해 3위로 집계됐다 이웅찬 연구원은  아크 ETF나 헬스케어 섹터 등 금리에 민감한 부문에서 지난 5월 중순 이후 반등이 이어지고 있다 며  물가 압력은 완화되고ㅓ 있으며 나스닥에 대한 밸류에이션 압력은 완화되고 있으니 상대적으로 주가 퍼포먼스는 더 나을 것 이라고 전망했다 
