title,date,content
“레미콘차 규제에…제품값 50% 오르는 동안 운반비는 130%↑”,2022-07-07,정부 규제 개혁 드라이브 걸자 중기중앙회 현장 간담회 개최 레미콘차 신규 진입 제한으로 운송비 부담 크게 늘었다 차량 진입 권한 국토부보다 지자체로 가야 주장도 나와 레미콘 경영난은 단가 후려치기 등 왜곡된 구조 탓  반박도김기문  사례 직접 발굴   한덕수와 규제 개혁 토론회 검토  서울경제 중소기업중앙회가 중소벤처기업부와 함께 7일 하남시청에서 개최한  중기 규제발굴 현장 간담회 에서 관계자들이 규제 사례에 대해 논의를 나누고 있다    사진제공 중기중앙회 현재 전국 레미콘 제조 업체가 994개로 2009년부터 10년 간 34% 늘었습니다  하지만 레미콘 트럭 신규 등록은 단 한 대도 내주지 않습니다  사정이 이렇게 되니 2009년을 기준으로 현재까지 레미콘 가격 인상은 47%인데 1회당 운반비는 130%나 뛰었습니다  윤석열 정부가 규제 개혁을 통해 민간 주도 성장을 이끌겠다는 큰 그림을 그리고 있는 가운데 레미콘 업계에서 믹서 트럭 레미콘 운송 차량  수급 제한 규제의 개선 요구가 높아지고 있다  운송 트럭의 신규 진입이 막힌 탓에 비용 부담이 크게 늘어났다는 게 이들의 목소리다 중소기업중앙회가 중소벤처기업부와 함께 7일 하남시청에서 개최한  중기 규제발굴 현장 간담회 에서는 레미콘 믹서트럭의 신규 등록 제한을 완화해 달라는 주장이 나왔다  배조웅 한국레미콘공업협동조합연합회장은  레미콘 수급 제한 규제를 없애 달라고 몇 차례나 하소연했지만 해결이 안됐다 며 이런 의사를 전달했다 현재 국토교통부는 건설기계 공급 과잉을 막는다는 목적에서 2년마다 건설기계수급조절위원회를 통해 믹서트럭 등의 수급을 조절하고 있다  이에 2009년 8월 1일 이후부터 레미콘 운송 차량의 신규 진입을 제한한 국토부는 2023년까지 이 조치를 연장하기로 했다 레미콘 차주를 보호한다는 취지로 12년째 같은 조치가 이어지자 업체들 입장으로서는 불만의 목소리가 큰 상황이다  공급이 제한되다 보니 가격 운송비 이 크게 뛸 수밖에 없다는 게 업계의 하소연이다  실제 지난 2009년부터 올해 7월까지 레미콘 가격의 연평균 상승률은 3 6% 수준이지만 운송비는 10 3%에 달하는 것으로 나타난다  아울러 적지 않은 운송 차주들의 파업 운송거부  또한 업체들은 큰 리스크로 꼽고 있다 업계는 수급 조절을 국토부에서 관리하는 것도 맞지 않다고 꼬집었다  배 회장은  왜 권한을 국토부에서 붙들고 있냐 며  레미콘 공장 허가를 내주는 지자체장이 그 지역에서 차량이 남는지 부족한지 그 여부를 더 잘 알 수 있지 않나  이해가 가지 않는다 고 지적했다 그러면서 수급조절위원회에 업계 인사를 참여 시켜 줄 것을 요청했다  전체 위원 15명 중 중소 업체 관계자의 참석은 배제한 반면 노조 관계자는 3명을 참석시키는 게 맞지 않다는 주장이다 한편 이날 이번 간담회에서는 중기 업계에서 인력 환경 인증 등에 대한 규제 개선의 요구가 이어졌다 김기문 중기중앙회장은  규제 혁신을 통해 정부는 예산을 들이지 않고도 기업 혁신 성장을 유도할 수 있다 며  조만간 중기중앙회 전 임직원이 전국의 기업 현장을 직접 방문해 구체적인 규제 사례를 발굴하고 정부에 건의할 계획 이라고 밝혔다  김 회장은  한덕수 총리가 중기중앙회를 방문해 규제 개혁 토론회를 여는 것도 계획하고 있다 고 말했다 
"'부동산 부자' 고소영, 성동구 '40억대' 빌딩도 샀다",2022-07-07,대표이사 맡았던 9코어홀딩스  지난 2월 5층짜리 건물 매입배우 고소영   자료사진  2018 6 5 뉴스1 © News1 권현진 기자 서울 뉴스1  박승희 기자   배우 고소영씨가 대표이사를 맡았던 한 주식회사가 서울 성동구 일대의 5층짜리 건물을 매입한 것으로 알려졌다 7일 조선비즈에 따르면 고소영이 대표로 있었던 주식회사 9코어홀딩스는 지난 2월 지상5층  연면적 352 75㎡ 규모 성동구 송정동의 한 건물을 39억5000만원에 매입했다 9코어홀딩스는 지난해 12월1일 설립된 회사다  고씨가 지난 5월까지 대표이사를 맡은 것으로 알려졌다  현재는 고씨의 친오빠로 알려진 고상균씨가 맡고 있다 고씨는 배우자 장동건씨와 함께 연예계 대표 부동산 부자로 알려져 있다  이들 부부는 강남구 청담동과 용산구 한남동에 빌딩을 소유한 것으로 전해진다 고씨 부부가 거주 중인 것으로 알려진 아파트는 강남구 청담동 더펜트하우스청담 PH129 이다  PH129 전용면적 273 96㎡은 지난해 최고 115억원에 매매된 바 있다 
삼성전자 2분기 선방… ‘3나노’ ‘Z폴드4’에 3분기 성패 달렸다,2022-07-07,삼성전자가 경기침체에 따른 수요 부진 등 악재를 견디고 2분기에 시장 기대치를 부응하는 양호한 성적표를 받았다  하지만 3분기 상황을 녹록지 않다  경기 상황이 한층 나빠질 전망이라 폴더블 스마트폰 신제품과 반도체 선전이 절실하다   3나노   Z폴드4 에 성패가 달린 것이다 삼성전자는 2분기에 매출 77조원  영업이익 14조원을 잠정 기록했다고 7일 밝혔다  지난해 같은 기간보다 매출은 20 94%  영업이익은 11 38% 늘었다  2분기를 기준으로 매출은 역대 최대치  영업이익은 3번째로 많은 수치다 올해 2분기 실적은 금융투자업계 전망치 매출 77조567억원  영업이익 14조7483억원 에서 크게 벗어나지 않았다  시장에서는 대외 악재에도 선방했다고 평가했다 특히 반도체의 선전이 큰 역할을 했다  삼성전자는 2분기에 반도체에서만 약 10조원가량 영업이익을 거둔 것으로 분석된다  데이터센터를 중심으로 램  낸드플래시 등의 메모리 반도체 수요가 꾸준하게 유지됐다  여기에 4나노 공정 수율이 올라가면서 파운드리 분야 수익성도 개선된 것으로 보인다 디스플레이는 아이폰 판매량 증가의 영향으로 1조원 안팎 영업이익을 달성한 것으로 추산된다  MX부문은 스마트폰의 판매 부진 본격화로 영업이익이 2조5000억원가량에 그친 것으로 보인다  갤럭시 S22는 비교적 선전했지만  중저가 모델이 판매 부진에 빠지면서 출하량이 1분기보다 15% 이상 줄었다 TV와 가전은 경기 침체에 따른 판매 부진  인플레이션에 따른 원가 상승 등으로 약 7000억원의 영업이익을 올리는 데 그친 것으로 진단된다 시장에서는 하반기에 삼성전자가  기술 초격차 를 바탕으로 여러 악재를 견딜 수 있을지가 관건이라고 판단한다  하반기에도 견조한 실적을 거두려면 3나노를 주축으로 하는 반도체 초미세공정의 수율 확보  갤럭시 Z폴드4 Z플립4의 성공이 절실하다 메모리 반도체의 경우 주요 고객사가 재고를 충분히 확보한 상태라 3분기부터 수요 감소가 불가피하다  수요가 줄면서 D램 가격 하락 폭도 예상보다 클 것이라는 관측이 제기된다  시장조사업체 디램익스체인지는 최근 3분기 D램 가격의 하락 폭이 10%로 확대된다고 내다봤다 삼성전자는 세계 최초로 양산에 들어간 3나노 게이트올어라운드 GAA  공정의 수율을 끌어올려 하반기부터 본격적으로 고객 확보에 나설 전망이다  4나노 공정 수율도 계속 안정화하고 있어 3나노 수율 확보가 TSMC와의 경쟁에서 중요 변곡점이다 또한 다음 달 10일에 공개 예정인 Z폴드4  Z플립4는 올해 삼성전자의 스마트폰 사업에서 최대 변수다  상반기 출시한 갤럭시 S22의 실적은 양호한 편이었지만  각종 논란으로 삼성전자 스마트폰 브랜드 이미지를 높이는 데 기여하지 못했다  중저가 시장은 중국 업체들도 부진을 피할 수 없을 정도로 시장 자체가 급격하게 위축하고 있다  전 세계 스마트폰 시장은 2분기에만 전년 동기보다 10% 가량 줄어들었다 삼성전자는 하반기에 모든 역량을 집중해 Z폴드4와 Z플립4 판매량을 늘린다는 계획이다  시장이 축소하는 걸 피할 수 없는 환경이지만 폴더블폰을 앞세워 새로운 시장을 만들고 수익성도 개선한다는 전략을 짜고 있다 
"'튀김소보로' 성심당, 작년 매출 628억원… 비결 들어보니",2022-07-07,코로나19에도 사상 최대 실적  단일 베이커리 브랜드 처음 대전서만 매장 운영  희소성   이성당 옵스 삼송빵집과 차별화 대전 성심당이 코로나19에도 불구하고 처음으로 매출 600억대를 넘기며 사상 최대 실적을 기록했다  사진 최태영 기자대전 성심당  군산 이성당  부산 옵스  대구 삼송빵집  빵으로 유명한 전국 4대 단일 빵집 중 성심당이 지난해 코로나19에도 불구하고 처음으로 매출 600억대를 훌쩍 넘겨 사상 최대 실적을 올렸다 7일 금융감독원에 따르면 성심당을 운영하는 로쏘㈜는 지난해 매출이 628억 원으로 전년 대비 28 6% 증가했다  사상 최대 실적이다  대형 프랜차이즈를 제외하고 단일 베이커리 브랜드 매출이 600억 원을 넘은 것도 성심당이 국내 처음이다 영업이익은 105억 원으로 전년 61억8900여만 원  대비 69 6% 늘었다  순이익 역시 92억 원으로 전년 22억1000여만 원 보다 320%나 증가했다  성심당은 성장 비결과 관련해 비대면이 늘어난 것 외에 특별한 변화는 없다고 전했다 성심당은 1956년 현 임영진 대표의 선친 임길순 옹이 대전역 광장 한쪽에서 천막을 치고 성당 신부로부터 지원받은 밀가루 2포대로 찐빵집을 연 것이 모태다  이후 66년 동안 대전 매장만 고집하고 있다  현재도 대전에서만 5개 매장을 운영하고 있다  한때 빵 테마파크 조성  세종 진출 등 확장도 검토했지만 코로나19 사태를 겪으며 내실을 다지는데 주력하고 있다 제과업계는 성심당의 성장 비결로  희소성 을 꼽는다  튀김 소보로로 유명한 성심당은 대전에서만 매장을 운영하는데다 소비자의 충성도 역시 높다는 평이다 옛 성심당 모습  사진 성심당 제공공교롭게 수도권 등지에 진출해  전국구 베이커리 를 표방하며 확장 전략을 써 온 군산 이성당  부산 옵스  대구 삼송빵집 등 나머지 3대 브랜드는 여전히 매출 100 200억대로 큰 성장세를 이어가지는 못하고 있다 성심당보다 11년 빠른 1945년 문을 열어 국내서  현존하는 가장 오래된 빵집 으로 유명한 군산 이성당은 지난해 매출이 217억 원으로 전년보다 10 4% 늘었다  영업이익과 순이익은 14억 원  11억 원으로 각각 29 6%  17 7% 줄었다 부산의 명물로 알려진 옵스 베이커리는 지난해 매출이 250억 원으로 전년 대비 5 0% 늘어난 반면 순이익은 4억6700만원으로 59 8% 줄었다  이성당과 옵스 모두 서울 롯데백화점에 매장을 냈고  수도권 일대에서도 일부 점포를 운영하고 있다 대구 삼송빵집은 지난해 매출이 103억 원으로 전년비 14 5% 줄었고  9억 원의 적자를 냈다 제과업계 관계자는  대형 프랜차이즈와는 다른 특색있는 차별화 전략 없이는 무한경쟁 시대에 살아남기 어려운 게 현실 이라고 말했다 
‘글로벌 스탠더드’라더니...손바닥 뒤집듯 정권따라 바뀌는 나라 살림 지표,2022-07-07, 통합재정수지 서  관리재정수지 로나라 살림 지표 1년 여 만에 변경기준 손대면 재정운용 계획 차질전문가  정부 정책 신뢰도에 흠집 최상대 기획재정부 차관이 7월 6일 정부세종청사에서 열린  22년 국가재정전략회의 주요 내용 사전 브리핑 에서 주요내용을 발표하고 있다  기획재정부 제공정부가 재정수지를 나타내는 기준지표를  통합재정수지 에서  관리재정수지 로 변경하기로 했다  나라 살림을 보여주는 대표 지표가 불과 1년여 만에 다시 바뀐 것이다  기획재정부는 지난해 3월  글로벌 스탠더드 라며 재정 관리 지표를 통합재정수지로 정한 바 있다  정부가 필요에 따라 재정 관리 기준마저 수시로 바꾼다는 지적이 나온다 7일 국가재정전략회의에서 눈에 띄는 부분은 관리재정수지를 재정 관리 지표로 정한 것이다  관리재정수지는 통합재정수지 총수입에서 총지출을 뺀 값 에서 국민연금과 고용보험 등 4대 사회보장성 기금 수지를 뺀 수치다  사회보장성 기금 수지는 매년 대규모 흑자를 기록해 왔다  사회보장성기금에 돈을 내는 사람은 많지만  돈을 찾아가는 사람은 상대적으로 적어서다 이 때문에 기재부는 전체 재정 현황을 파악하는 데 왜곡이 생길 수 있다며 국내에서만 통용되는 관리재정수지를 만들어 써왔다  지난해 통합재정수지 적자는 30조5000억원   관리재정수지 적자는 90조6000억원으로 60조원 이상 차이가 났다  최상대 기재부 2차관은 재정준칙 법제화 방침을 밝히면서  통합재정수지보다 엄격한 관리재정수지를 기준으로 준칙을 설정할 것 이라고 했다 문제는 정권이 바뀌자 재정수지 기준에 대한 정부 판단이 뒤바뀌었다는 점이다  지난해 기재부는  국제 기준 에 맞춰 재정수지를 더 엄격하게 관리해야 한다는 이유로 재정수지 기준을 통합재정수지로 변경한 바 있다  국제비교 때는 통합재정수지가 쓰인다 지난해 3월 안도걸 기재부 예산실장은 추가경정예산 추경  브리핑에서  과거에는 국민연금 등이 계속 흑자를 내서 관리할 필요가 없었지만  지금은 고용보험 같은 경우 보험료보다 급여가 더 급속히 늘고 있어서 정부가 가장 먼저 관리해야 할 기금으로 변경됐다 며  이에 따라 재정수지 기준을  통합재정수지로  변경했다 고 했다  그러면서  국제적으로 통용되는 게 통합재정수지 라며   재정수지  기준을 바꿀 때가 됐다 고 강조했다 당시 기재부가 재정수지 기준을 변경하려 하자 일각에서는 정부가 추경을 하기 위해 꼼수를 쓰는 것 아니냐는 비판이 나왔다  통합재정수지는 관리재정수지보다 40조 60조원 가량 수입이 더 많아 관리재정수지에서 통합재정수지로 기준을 바꾸면 재정수지 적자가 규모가 그만큼 줄어든다 1년여 만에 나라살림 대표 지표를 바꾼 이유에 대해 최 차관은  그 당시에는 통합재정수지가 국제 기준에 맞는 지표라는 차원에서 통합재정수지 기준을 메인지표로 설정했다 며  지금은 재정건전성이 많이 악화된 상태에서 재정건전성을 좀 더 엄격하게 관리해야 되는 차원에서는 관리재정수지를 기준으로 해서 준칙을 설정해서 운용하는 것이 맞다 고 설명했다 이를 두고 재정 적자 상황을 정권 입맛대로 늘리거나 축소하기 위해 기준이 되는 지표를 바꾼다는 지적이 나온다  재정운용 기조는 경제 상황에 따라 달라질 수 있지만 기준까지 손대면 장기 재정운용 계획을 세우는 데 차질을 빚을 수 있다  우석진 명지대 교수 경제학 는   재정을 엄격하게 관리하려 한다면  관리재정수지가 방향성에서 맞지만 손바닥 뒤집듯 입장을 바꾼 것에 대해서는 정부가 해명할 필요가 있다 며  결과적으로 정부의 정책 신뢰도에 흠집이 생긴 것 이라고 말했다 
"[LG전자 2Q 실적] 가전·TV, 악재 속 매출 선방…수익성은 '뚝'",2022-07-07,H&A  매출 성장에도 영업이익 감소 HE  영업이익률 0 5% 전망LG전자 실적에 효자 역할을 하고 있는 가전과 TV 사업부가 2분기 부진한 성적표를 받아든 것으로 관측된다  수요 둔화 속에도 매출은 비교적 선방했지만  영업이익이 큰 폭 떨어지며 수익성이 악화됐을 것이란 전망이다 LG전자는 2분기 잠정 실적 발표를 통해 매출 19조4천720억원  영업이익 7천917억원을 기록했다고 7일 밝혔다  전년 대비 매출은 15% 증가한 반면 영업이익은 12% 감소했다 이는 시장 전망치를 소폭 하회하는 수준이다  금융정보업체 에프앤가이드에 따르면 LG전자의 실적 컨센서스 증권사 평균 전망치 는 매출 19조5천226억원  영업이익 8천392억원이었다 LG 올레드 에보 갤러리에디션  사진 LG전자 증권가에선 생활가전을 담당하는 H&A사업본부의 매출은 7조원 중후반대  영업이익은 4천억원 중반대로 예상하고 있다  매출은 전년보다 약 1조원 늘어났지만  영업이익은 2천억원가량 줄어든 수치다 TV를 담당하는 HE사업본부의 경우 영업이익률이 크게 떨어진 것으로 관측된다  HE사업본부의 영업이익률은 지난해 2분기 8 2%에 달했지만  올해 1분기 4 6%를 기록했고 2분기에는 0 5%까지 떨어진 것으로 전망된다 2분기 HE사업본부 매출은 3조원 후반대  영업이익은 200억원 초반대로 관측된다  전년보다 매출은 소폭 줄어든 반면 영업이익은 큰 폭 떨어진 수치다 업계에선 지난해 펜트업 pent up 보복소비  효과로 인해 가전과 TV 시장이 뜻밖의 호황을 누렸지만  올 들어 수요가 둔화된 것으로 보고 있다  여기에 원자재 가격 상승과 물류비 인상 등이 수익성에 영향을 미친 것으로 보인다 시장조사업체 옴디아에 따르면 올해 전 세계 TV 출하량은 2억879만4천 대로  전년 대비 474만3천 대가량 감소할 것으로 예상된다  앞서 옴디아는 지난 3월 연간 TV 출하량이 2억1천163만9천 대로  12년 만에 최저치를 기록할 것으로 예상했는데  전망치를 더욱 낮췄다 권성률 DB금융투자 연구원은  TV는 펜트업 소비가 꺾였고  인플레이션과 고금리 현상에 따라 소비심리가 위축돼 시장 수요가 감소했다 면서  원재료비  물류비 등은 상승하면서 2분기 HE사업본부의 수익성은 매우 부진할 것 이라고 예상했다 고의영 하이투자증권 연구원은  최근 유럽을 중심으로 TV 판매가 부진한 것으로 파악된다 며  러시아 우크라이나 전쟁 영향으로 에너지 가격이 치솟으며 소비 심리가 나빠진 영향 이라고 말했다 이어  가전은 그동안 미국을 중심으로 수요가 좋았지만  최근 금리 인상과 더불어 주택 지표가 부진하다 며  이에 따라 가전 수요도 둔화될 가능성이 있다 고 덧붙였다 
이재용 대신 美선밸리 '억만장자 모임' 간 삼성 사람은 누구?,2022-07-07,6일 현지시간  미국 아이다호주 선밸리에서 열린 콘퍼런스에 참석한 최경식 삼성전자 북미총괄 사장 왼쪽 과 이원진 삼성전자 영상디스플레이사업부 사장 오른쪽 의 모습   이미지출처 로이터연합뉴스 이재용 삼성전자 부회장이 재판 일정으로 불참한 전 세계 IT 미디어 업계 거물들의 사교모임인 미국 선밸리 콘퍼런스에 최경식 삼성전자 북미총괄 사장과 이원진 삼성전자 영상디스플레이사업부 사장이 참석했다 6일 현지시간  비즈니스인사이더와 AFP통신 등에 따르면 미 아이다호주 선밸리에서 열린 선밸리 컨퍼런스에 한국인 중에서는 최 사장과 이 사장이 참석했다  최 사장은 2020년 12월부터 삼성전자 북미총괄직을 맡아왔으며  2022년도 정기인사에서 사장으로 승진했으며  구글 총괄 부사장 출신의 이 사장은 2014년 5월 삼성전자에 합류한 뒤 지난해 7월 사장 승진했다 선밸리 콘퍼런스는 미국 투자은행 앨런앤드컴퍼니가 1983년부터 매해 주최해온 국제 비즈니스 회의로  초청받은 인물만 참석할 수 있다  거물들의  여름캠프 라고 불릴 정도로 많은 미디어 IT 업계 거물들이 모이는 행사로 행사 직전 이 지역에 글로벌 기업의 수장들이 탄 전세기가 잇따라 도착하는 진풍경이 벌어지기도 한다 당초 이 행사는 이 부회장이 6년 만에 직접 참석할 것으로 예상됐으나 결국 참석이 불발됐다  이 부회장은 2002년부터 2016년까지 매년 참석했지만 재판 일정 탓에 올해 불참했다  앞서 이 부회장은 2017년 국정농단 재판에서  선밸리는 1년 중 가장 바쁜 출장이고  가장 신경 쓰는 출장 이라고 말하기도 했다 올해는  투자의 귀재 로 불리는 워런 버핏 버크셔해서웨이 최고경영자 CEO 를 비롯해 파라그 아그라왈 트위터 CEO  셰릴 샌드버그 메타 최고운영책임자 COO   메리 바라 제너럴모터스 GM  CEO  다라 코스로샤히 우버 CEO  존 도나호 나이키 CEO  밥 아이거 전 디즈니 회장  RJ 스카링게 리비안 CEO 등이 참석했다 
재정적자 GDP 대비 3%이내로…초중등 교부금 줄여 대학에 지원,2022-07-07, 윤석열 대통령이 7일 오전 충북 청주시 충북대학교에서 열린 2022 국가재정전략회의에서 발언을 마친 뒤 자료를 살펴보고 있다   사진 연합뉴스  윤석열 정부가 국내총생산 GDP  대비 국가채무비율을 50% 중반대로 관리하겠다는 목표를 세웠습니다    GDP 대비 관리재정수지 적자는 당장 내년부터 코로나19 이전 수준인 3%이내로 되돌리고  재정준칙도 통합재정수지보다 더 엄격한 관리재정수지 기준으로 변경합니다    정부는 오늘 7일  윤석열 대통령이 주재한 국가재정전략회의에서 이같은 계획을 발표했습니다 우선 GDP 대비 국가채무비율을 2027년까지 50% 중반대에 묶어두기로 했습니다  올해 연말 기준 예상 국가채무비율은 49 7% 2차 추가경정예산 기준 입니다 국가채무비율 상승 폭을 역대 정부 평균 5∼6%포인트  수준으로 되돌리겠다는 건데  앞서 문재인 정부 5년간 국가채무비율은 14%넘게 상승했습니다 또 관리재정수지 적자를 코로나 이전 수준으로 개선하기로 했습니다    올해 5 1% 2차 추경 기준 로 예상된 GDP 대비 관리재정수지 적자 비율을 당장 내년에 3% 이내로 줄일 계획입니다 재정을 통제하기 위한 재정준칙 역시 통합재정수지가 아닌 관리재정수지를 활용해 더욱 엄격하게 관리합니다    관리재정수지는 통합재정수지 총수입 총지출 와 달리 국민연금 등 사회 보장성 기금 수지를 제외하고 산출하는 지표로  나라의 실질적인 재정 상태를 나타냅니다 통합재정수지에서 관리재정수지로 관리 기준을 변경하면 올해 경상 GDP 2천180조원  기준으로 대략 40조∼45조원 GDP의 2%  정도 더 적자를 줄이게 되는 셈이라고 정부는 설명했습니다    복잡한 곱셈식인 재정준칙 산식도 단순한 수지 채무 기준으로 바꿉니다    정부가 이처럼 재정 허리띠를 졸라매기로 한 것은 최근 나랏빚이 급격히 증가하고 있기 때문입니다    기재부에 따르면 올해 국가채무는 사상 처음으로 1천조원을 돌파하게 됩니다  지난 2017년 660조원이었던 국가채무는 올해 약 1100조원까지 늘어날 것으로 전망됩니다  5년 만에 국가채무가 416조원 불어나는 셈인데  이는 직전 5년간 국가채무 증가치 170조원 의 2 4배에 달하는 수준입니다 정부는  고등 평생교육지원 특별회계 를 만들어 초 중 고교에 투자했던 재원 일부를 대학과 평생교육 부문에 사용하기로 했습니다 나라 살림 규모는 커지는데 학령인구가 계속 줄면서 유 초 중등교육에 사용되는 재원에 비해 고등 평생교육 부문에 투자하는 재원이 부족하다는 지적에 따른 것입니다 이에 따라 현재 내국세의 20 79% 수준인 지방교육재정교부금 교부금  제도를 개편합니다 다만 예산이 줄어드는 17개 시도교육청을 비롯한 교육계의 거센 반발이 예상됩니다  
